{
  "insp_id": "2016082568774080",
  "layout": "a",
  "customer_id": "328312",
  "customer_name": "Amy Waxman",
  "customer_addr": "45 Old Brook Road\nHuntington Station, NY 11746",
  "certificate": "--",
  "site_id": "001",
  "site_name": "AMY WAXMAN",
  "insp_type": "ROUTINE INSPECTION",
  "date": "06-SEP-2017",
  "report_date": "06-SEP-2017",
  "citations": [
    {
      "code": "2.1(a)(1)",
      "kind": "",
      "repeat": false,
      "desc": "REQUIREMENTS AND APPLICATION.",
      "narrative": "This was a search for covered activities\nItem Requirements and Licensing 2.1 a\nAt the time of inspection it was determined that Amy Waxman is selling sugar gliders and is operating as a dealer\nand thereby requiring a license under the AWA. (13 breeding pairs). The applicant shall provide the information\nrequested on the application form, to include a valid mailing address through which the applicant can be reached at\nall times. The applicant shall file the completed form and forward it to the regional office in North Carolina.\nAt this time Amy Waxman is known to be selling sugar gliders This activity requires a USDA Class A license.\nFacility needs to obtain a USDA license if they wish to continue this regulated activity."
    },
    {
      "code": "2.40(a)",
      "kind": "",
      "repeat": false,
      "desc": "ATTENDING VETERINARIAN AND ADEQUATE VETERINARY CARE (DEALERS AND EXHIBITORS).",
      "narrative": "Item Vet Care 2.40 a\nAt the time of inspection it was determined that Mrs Waxman is operating as a dealer requiring a License and with\nthat, a written program of veterinary care is developed and available for review.\nAt this time a program of vet care was not available for review."
    },
    {
      "code": "2.75(b)(2)",
      "kind": "",
      "repeat": false,
      "desc": "RECORDS: DEALERS AND EXHIBITORS.",
      "narrative": "Item records 2.75 b 2\nAt the time of inspection it was determined that the owner is operating as a dealer requiring a license. The person\nhas sugar gliders for breeding and selling, as well as sugar gliders for rescue and sugar gliders for pets.\nThere are no records of acquisition or selling of sugar gliders,nor records of which ones are rescued and pets.\nApplicant needs to develop a record keeping system to differentiate the different sugar gliders."
    },
    {
      "code": "3.128",
      "kind": "",
      "repeat": false,
      "desc": "SPACE REQUIREMENTS.",
      "narrative": "Item Space Requirements 3.128\nAt the time of inspection applicant had over 30 cages for sugar gliders used for personnel pets, rescue and\nbreeders. Of the 30 cages only 2 were 30 inches high the rest were 21 in high.\nFor regulated activities cages for sugar gliders need to be at least 30 in high to allow for normal behavior patterns."
    },
    {
      "code": "3.131(b)",
      "kind": "",
      "repeat": false,
      "desc": "SANITATION.",
      "narrative": "Item Sanitation 3.1131 b\nAt the time of inspection the owner indicated that the cages were cleaned with a combination of vinegar and\nalcohol. Acceptable methods include hot water, detergent or an effective disinfectant\nThe applicant needs to check with a veterinarian to see if vinegar and alcohol is an effective method\nNO COVERED ACTIVITIES UNTIL LICENSED\nAn application packet was left with the owner, the application will be completed and forwarded to\nUSDA-APHIS-AC\n920 MAIN CAMPUS DR\nSUITE 200\nRaleigh NC 27606\n919 855 7100\nAn exit interview was done with the owner"
    }
  ],
  "narrative": "2.1(a)(1)\nREQUIREMENTS AND APPLICATION.\nThis was a search for covered activities\nItem Requirements and Licensing 2.1 a\nAt the time of inspection it was determined that Amy Waxman is selling sugar gliders and is operating as a dealer\nand thereby requiring a license under the AWA. (13 breeding pairs). The applicant shall provide the information\nrequested on the  application form, to include a valid mailing address through which the applicant can be reached at\nall times. The applicant shall file the completed form and forward it to the regional office in North Carolina.\nAt this time Amy Waxman is known to be selling sugar gliders This activity requires a USDA Class A license.\nFacility needs to obtain a USDA license if they wish to continue this regulated activity.\n2.40(a)\nATTENDING VETERINARIAN AND ADEQUATE VETERINARY CARE (DEALERS AND EXHIBITORS).\nItem Vet Care 2.40 a \nAt the time of inspection it was determined that Mrs Waxman is operating as a dealer requiring a License and with\nthat, a written program of veterinary care is developed and available for review.\nAt this time a program of  vet care was not available for review.\n2.75(b)(2)\nRECORDS: DEALERS AND EXHIBITORS.\nItem records 2.75 b 2\nAt the time of inspection it was determined that the owner is operating as a dealer requiring a license.  The person\nhas sugar gliders for breeding and selling, as well as sugar gliders for rescue and sugar gliders for pets.\nThere  are  no records of acquisition or selling of sugar gliders,nor records of which ones are rescued and pets.\nApplicant needs to develop a record keeping system  to differentiate the different sugar gliders.\n\n3.128\nSPACE REQUIREMENTS. \nItem Space Requirements 3.128\nAt the time of inspection applicant had over 30 cages for sugar gliders used for personnel pets, rescue and\nbreeders. Of the 30 cages only 2 were 30 inches high the rest were 21 in high. \nFor regulated activities cages for sugar gliders need to be at least 30 in high  to allow for normal behavior patterns.\n3.131(b)\nSANITATION.   \nItem Sanitation 3.1131 b\nAt the time of inspection the owner indicated that the cages were cleaned  with a combination of vinegar and\nalcohol. Acceptable methods include hot water, detergent or an effective disinfectant \nThe applicant needs to check with a veterinarian to see if  vinegar and alcohol is an effective method\nNO COVERED ACTIVITIES UNTIL LICENSED\nAn application packet was left with the owner, the application  will be completed and forwarded  to\nUSDA-APHIS-AC\n920 MAIN CAMPUS DR\nSUITE 200\nRaleigh NC 27606\n919 855 7100\nAn exit interview was done with the owner",
  "animals_total": 100,
  "species": [
    {
      "count": 100,
      "scientific": "Petaurus breviceps",
      "common": "SUGAR GLIDER"
    }
  ]
}